Betoken,https://github.com/Betoken,--,Other,Decentralized hedge fund,Others,Betoken will mint Betoken Shares and send them to the current development team,"Other (if DAO, specify name in DAO Name column)",Opt-out governance,--,--,--,--,--,"Betoken is a decentralized hedge fund that uses a one-of-a-kind Incentivized Meritocracy to invest in ERC20 tokens, powered by Ethereum.",--,--,--,,
BrightID,https://github.com/BrightID,--,Other,Identity verification system; can fit into dApp ecosystem,Product/service sales income,,"Other (if DAO, specify name in DAO Name column)",DAO,--,--,--,--,--,BrightID is a privacy-first social identity network that allows people to prove to applications that they are accessing them fairly with only one account. Funded by the purchase of sponsorships by applications for user verification and ranking benefits.,--,BrightID,--,,
CoinPokerOfficial,https://github.com/CoinPokerOfficial,--,DApp,,Public token sale,,"Other (if DAO, specify name in DAO Name column)",DAO,https://coinmarketcap.com/currencies/coinpoker/,--,"274,720,000",--,--,"CoinPoker is a cryptocurrency based worldwide online poker room. It combines blockchain technology with online gaming, addressing issues like geographic restrictions and payment delays commonly associated with traditional online poker platforms.",--,CoinPoker,--,,
Octogen Dev Teams,https://github.com/dbpunk-labs,--,Other,"Not a project, is an organization. Project type is not clear; can be database technology + development tool",Crowdfunding without token,,Not centrally organized (just the GitHub and nothing else),,--,--,--,--,--,"Octogen Dev Team has two main projects: db3, a lightweight, permanent JSON document database, and octogen, an open-source code interpreter agent framework. Nothing else is posted about the organization.",--,--,--,,
Dystopia,https://github.com/dystopia-exchange,--,DApp,DApp + Crypto exchange,Public token sale,,"Other (if DAO, specify name in DAO Name column)",DAO,https://coinmarketcap.com/currencies/dystopia/,--,"300,956,526",--,--,"Dystopia's goal is fair and balanced access to DeFi. They are a decentralized exchange that has launched on the Polygon network with low fees, near 0 slippage on correlated assets and a strong focus on secondary markets for tokenized locks as NFT’s.",--,Dystopia,--,,
Fetch.AI,https://github.com/fetchai,--,L1 protocol,L1 protocol + DApp,Public token sale,,Private company ,,--,--,--,--,--,"Fetch.ai's vision is to create an AI-empowered platform that can connect services and APIs without any domain knowledge. The technology is built on four key components: AI Agents, the Agentverse, the AI Engine, and the Fetch Network.",--,--,--,,
GOF-EDV,https://github.com/GOF-EDV/mine-backend,--,DApp,,Others,Not stated,Private company ,,--,--,--,--,--,"Almost no information is available online. The project, called Mine, has both frontend and backend components. Most of the information on their GitHub is in Spanish.",--,--,--,,
Chain-Cloud,https://github.com/icpfoundation,--,DApp,,Others,Not stated,Private company ,,--,--,--,--,--,"Very sketchy. Has a website, but grammar is very poor and most of the website is incomplete and ""Coming soon."" Little other information can be found online.",--,--,--,,
KuChain,https://github.com/KuChainNetwork,--,L1 protocol,,Others,Not stated,"Other (if DAO, specify name in DAO Name column)",DAO,--,--,--,--,--,Very sketchy. Their website is down and unavailable. Little other information can be found online.,--,KuChain,--,,
MatrixAINetwork,https://coinmarketcap.com/currencies/matrix-ai-network/,--,L1 protocol,,Public token sale,,"Other (if DAO, specify name in DAO Name column)",DAO,https://coinmarketcap.com/currencies/matrix-ai-network/,--,"746,832,189","1,000,000,000",--,"MatrixAINetwork involves core blockchain functionalities such as mining, staking, validating, and difficulty adjustment.",--,MatrixAINetwork,--,,
naboxwallet,https://github.com/naboxwallet,--,Wallet,Multi-chain wallet + Cross-chain DApp explorer,Public token sale,,Private company ,,https://coinmarketcap.com/currencies/nabox/,--,"208,610,000,000","1,000,000,000,000",--,Nabox is a multi-chain wallet and cross-chain DApp explorer that enables asset management and transactions across various blockchains.,--,--,--,,
BNB Chain,https://github.com/bnb-chain,--,L1 protocol,L1 protocol + L2 network,Public token sale,,Consortium,,https://coinmarketcap.com/currencies/bnb/,--,"147,582,326",--,--,"BNB Chain is a blockchain ecosystem supported by Binance, featuring both Layer-1 and Layer-2 scaling solutions, with BNB as its native token. While not a fully decentralized DAO, BNB Chain incorporates DAO-like features where governance decisions are made through consensus among validators and token holders",--,--,--,,
Play Game Pte Ltd,https://github.com/playgame-global,--,L1 protocol,,Others,Not stated,Not centrally organized (just the GitHub and nothing else),,https://coinmarketcap.com/currencies/playgame/,--,0,--,--,"When attempting to open the website, I was alerted that ""Attackers might be trying to steal your information from www.playgame.com."" All activity on the GitHub page was from 6 years ago. Almost no other information can be found online.",--,--,--,,
Razor Network,https://github.com/razor-network,--,Oracle,,Others,Not stated,"Other (if DAO, specify name in DAO Name column)",DAO,https://coinmarketcap.com/currencies/razor-network/,--,"328,245,504","1,000,000,000",--,"Razor Network is a decentralized oracle platform utilizing proof of stake consensus and its native token, RAZOR, to provide secure real-world data to blockchain applications. Stakers in the network participate in governance by voting, where the weight of their vote is determined by the amount of stake they hold in the network.",--,Razor Network,--,,
ShineChain,https://github.com/ShineChain,--,DApp,,Others,Not stated,"Other (if DAO, specify name in DAO Name column)",DAO,https://coinmarketcap.com/currencies/shine-chain/,--,0,"21,000,000",--,ShineChain is a decentralized blockchain platform facilitating global health mutual aid through its digital asset SHE. GitHub has not been updated in 8 years. Whitepaper is in full Chinese. Website is down and the domain currently for sale.,--,ShineChain,--,,
StarTerra,https://github.com/starterra,--,DApp,,Others,Not stated,"Other (if DAO, specify name in DAO Name column)",Not stated,https://coinmarketcap.com/currencies/starterra/,--,"33,134,374","100,000,000",--,"Following the collapse of the Terra ecosystem over a year ago, StarTerra, one of its largest launchpad platforms, closed down. After sustaining the website for another year, they've decided to permanently disable the StarTerra app, ending all associated services. GitHub page cannot be found.",--,--,--,,
Three0,https://github.com/Three0Dev,--,DApp,,Others,Not stated,Not centrally organized (just the GitHub and nothing else),,--,--,--,--,--,"Three0 is a decentralized development platform that empowers developers to build Web3 dApps seamlessly integrated with authentication, databases, and decentralized storage and hosting services.",--,--,--,,
Vcash,https://github.com/openvcash,--,Token,,Others,Not stated,Not centrally organized (just the GitHub and nothing else),,https://coinmarketcap.com/currencies/vcash-finance/,--,"7,620,000","20,000,000",--,V(anilla)cash (Vcash) is a decentralized cryptocurrency project. Website is down.,--,--,--,,
Yam Finance,https://github.com/yam-finance,--,Token,,Others,Distributes tokens through staking pools,"Other (if DAO, specify name in DAO Name column)",DAO,--,--,--,--,--,"Yam is a decentralized finance (DeFi) protocol featuring an elastic supply cryptocurrency aimed at achieving price stability. Ownership and control are fully decentralized, with governance managed by YAM token holders through on-chain voting from the project's inception.",--,Yam Finance,--,,
10k-swap ,https://github.com/10k-swap,--,DApp,,Public token sale,,"Other (if DAO, specify name in DAO Name column)",DAO,--,,--,--,--,"10k-swap is an Automated Market Maker built on the Starknet Mainnet. The DAO name hasn't been specifically mentioned but is refered to as ""10K DAO"" in documents and roadmaps ",--,10K DAO,--,,
coco-verse,https://github.com/coco-verse,--,DApp,,Donations,,Not centrally organized (just the GitHub and nothing else),,--,,--,--,--,"Coco is like a social networking site where users can create topics of interest, join groups, etc. In order to post in a group a user must undergo through challenges until it remains unchallenged. No specific details on the funding model, but operates within the Github Ecosystem which could mean donations ",--,--,--,,
bisharesindexfund,https://github.com/bisharesindexfund,--,DApp,,Donations,,"Other (if DAO, specify name in DAO Name column)",DAO,https://coinmarketcap.com/currencies/bishares/,,"432,235","1,000,000",--,BiShares is a decentralized application focused on decentralized exchange-traded and yield-bearing funds on Binance Smart Chain and Fantom.,--,BISON,--,,
Kodadot,https://github.com/kodadot,--,DApp,--,Crowdfunding without token,--,Non-Profit Foundation,--,--,--,--,--,--,--,--,--,--,,
Market Making Pro,https://github.com/marketmakingpro,--,Web 2.0 Business,--,Product/Service Sales Income,--,Private company ,--,--,--,--,--,--,--,--,--,--,,
Mushroom Protocol,https://github.com/Mushroom-Protocol,--,,Web3,Product/service sales income,--,Consortium,--,--,--,--,--,--,--,--,--,--,,
Omomo Finance,https://github.com/omomo-finance,--,DApp,--,Product/service sales income,--,Non-Profit Foundation,--,--,--,--,--,--,--,--,--,--,,
PixieCoin Foundation,https://github.com/PixieCoinFoundation,--,Token,--,Public Token Sale,--,Non-Profit Foundation,--,https://coinmarketcap.com/currencies/pixie/,--,"2,000,000,000","100,000,000,000",--,--,15%,--,--,,
Rainbow ME,https://github.com/rainbow-me,--,Wallet,--,Product/Service Sales Income,--,Private company ,--,--,--,--,--,--,--,--,--,--,,
Shadow Project,https://github.com/shadowproject,--,Token,--,Public Token Sale,--,Non-Profit Foundation,--,https://coinmarketcap.com/currencies/genesysgo-shadow/,--,"161,209,800",--,--,--,20%,--,--,,
X9 Developers,https://github.com/X9Developers,--,DApp,--,Crowdfunding without token,--,Not centrally organized (just the GitHub and nothing else),--,--,--,--,--,--,--,--,--,--,,
Freeverse IO,https://github.com/freeverseio,--,L1 protocol,--,Others,funded by companies,Private company ,--,--,--,--,--,--,--,--,--,--,,
Vac P2P,https://github.com/vacp2p,--,DApp,--,Product/service sales income,--,Private company ,--,--,--,--,--,--,--,--,--,--,,
Xfinite IO,https://github.com/xfinite-io,--,Crypto exchange,--,Public Token Sale,--,Not centrally organized (just the GitHub and nothing else),--,--,--,--,--,--,--,--,--,--,,
Asura World Project,https://github.com/asuracoin,Couldn't find,Web 2.0 business,,Public token sale,,Private company,,https://coinmarketcap.com/currencies/asura-coin/,,"220,932,400","1,000,000,000",No associated communities,,,,,,
Bitmon World,https://github.com/bitmon-world,Couldn't find,Other,Staking Program/Game?,Product/service sales income,,Not centrally organized,,No governance token,,N/A,N/A,No associated communities,Link led to shady website and not much clear information online,,,,,
Cartridge-gg,https://github.com/cartridge-gg,Couldn't find,Web 2.0 business,,Product/service sales income,,Private company,,No governance token,,N/A,N/A,No associated communities,,,,,,
Creator,https://github.com/creator-rs,Couldn't find,Other,Mobile Game Framework,Product/service sales income,,Private company,,No governance token,,N/A,N/A,No associated communities,,,,,,
zkRace,https://github.com/Derace,Couldn't find,Web 2.0 business,,Public token sale,,Private company,,https://coinmarketcap.com/currencies/derace/,,"120,000,000","120,000,000",No associated communities,,,,,,
eosDAC,https://github.com/eosdac,Couldn't find,Web 2.0 business,,Public token sale,,Not centrally organized,,https://coinmarketcap.com/currencies/eosdac/,,Not stated,"1,200,000,000",No associated communities,"Tokens in circulation is weird, says 0 even though there is $19,032 daily volume
",,,,,
FortressFinance,https://github.com/FortressFinance,Couldn't find,DApp,,Others,Couldn't find,Other,Couldn't find,No governance token,,N/A,N/A,No associated communities,,,,,,
havenprotocol,https://github.com/havenprotocol,https://bitcoinwiki.org/wiki/haven-protocol,Stablecoin,,Crowdfunding without token,,Not centrally organized,,https://coinmarketcap.com/currencies/haven-protocol/,,"47,313,093","47,313,093",No associated communities,,,,,,
IOST,https://github.com/iost-official,https://iq.wiki/wiki/iost/,DApp,,Others,Combination of Funding Rounds and Public Token sale,Not centrally organized,,https://coinmarketcap.com/currencies/iostoken/,,"21,315,000,000","21,315,000,000",No associated communities,,,,,,
Lilium,https://github.com/LiliumErgo,Couldn't find,DApp,,Product/service sales income,,Private company,,No governance token,,N/A,N/A,No associated communities,,,,,,
MilkShakeSwap,https://github.com/MilkShake-Swap,Couldn't find,Token,,Public token sale,,Other,Couldn't find,https://coinmarketcap.com/currencies/milkshakeswap-finance/,,Not stated,"1,208,577",No associated communities,"Tokens in circulation is weird, says 0 even though there is $177 daily volume
",,,,,
Nibble Network,https://github.com/Nibble-Network,Couldn't find,DApp,,Product/service sales income,,Private company,,No governance token,,N/A,N/A,No associated communities,,,,,,
Pancakelock,https://github.com/Pancakelock,Couldn't find,Other,Liquidity Locker,Others,Couldn't find,Private company,,No governance token,,N/A,N/A,No associated communities,Minimal information,,,,,
PowerPool Protocol,https://github.com/powerpool-finance,https://iq.wiki/wiki/powerpool/,DApp,,Product/service sales income,,Private company,,https://coinmarketcap.com/currencies/powerpool/,,"31,016,993","100,000,000",No associated communities,,,,,,
QuestgltNew,https://github.com/QuestgltNew,N/A,Other,"Not a project, just a user",Others,"Not a project, just a user",Other,"Not a project, just a user",No governance token,,N/A,N/A,No associated communities,"Not a project, just a user: Nothing created from this account, only forked",,,,,
LeeChunHao2000,https://github.com/LeeChunHao2000,N/A,Other,"Not a project, just a user",Others,"Not a project, just a user",Other,"Not a project, just a user",No governance token,,N/A,N/A,No associated communities,"Not a project, just a user: Some contributions, but nothing focused",,,,,
nn-dmt,https://github.com/nn-dmt,N/A,Other,"Not a project, just a user",Others,"Not a project, just a user",Other,"Not a project, just a user",No governance token,,N/A,N/A,No associated communities,"Not a project, just a user: Nothing much created from this account, mainly forked",,,,,
TriipMiles,https://github.com/triipme,https://bitcoinwiki.org/wiki/triipmiles,Token,,Others,Combination of public token sale and venture funds,Private company,,https://coinmarketcap.com/currencies/triipmiles/,,37M,500M,Sustainations DAO,,,,,,
Wallet 3,https://github.com/Wallet3,https://moralis.io/web3-wiki/wallet-3/,Wallet,,Product/service sales income,,Private company,,No governance token,,N/A,N/A,No associated communities,,,,,,
Aeonix,https://github.com/aeonix,N/A,Token,,Others,"Says ""100% community and volunteer grassroots driven approach"", not sure what that means",Private company ,,No governance token,N/A,N/A,N/A,Jekyll ,"Looks to be largely abandoned for the last couple months. Also, its value is currently extremely low at below one cent. Most of its technology is outdated.",Not Able to find,N/A,N/A,,
0xcregis,https://github.com/0xcregis,N/A,Wallet,,Product/service sales income,,"Other (if DAO, specify name in DAO Name column)",,N/A,n/A,N/A,N/A,n/A,"A good website with working links, the twitter has been updated recently. ",N/A,N/A,N/A,,
Beaboutyourlife,https://github.com/Beaboutyourlife,N/A,DApp,"It also is a ""Decentralized P2P healthcare system""",Product/service sales income,,"Other (if DAO, specify name in DAO Name column)",,N/A,N/A,N/A,N/A,"Elit Web3 Solutions, XDC", It is a decentralized healthcare system with zero government intervention.,N/A,HealthBank,N/A,,
casinolandnetwork,https://github.com/casinolandnetwork,N/A,DApp,,Product/service sales income,,Not centrally organized (just the GitHub and nothing else),,N/A,N/A,N/A,N/A,N/A,Only one commit on the github ever with only around 500 lines of code. It is a decentralized casino app but seems to have never been very successful. ,N/A,N/A,N/A,,
dethertech,https://github.com/dethertech,N/A,Crypto exchange,,Public token sale,,Private company ,,N/A,N/A,N/A,N/A,N/A,"https://isthiscoinascam.com/check/dether - According to this website, dether is a scam. ",N/A,N/A,N/A,,
fr8network,https://github.com/fr8network,N/A,Token,,Public token sale,,Not centrally organized (just the GitHub and nothing else),,N/A,N/A,N/A,N/A,N/A,The website looks so sketchy that I did not click on any links for fear of getting a virus. ,N/A,N/A,N/A,,
impactMarket,https://github.com/impactMarket,N/A,Other,"Many types rolled into one such as a wallet, network, exchange, and it also has its own token and currency. ",Public token sale,,Private company ,,https://coinmarketcap.com/currencies/impactmarket/,,"1,680,403,451","$10,000,000,000",N/A,,N/A,N/A,N/A,,
impeccableHQ,https://github.com/ImpeccableHQ,N/A,N/A,N/A,N/A,N/A,N/A,N/A,N/A,N/A,N/A,N/A,N/A,No data is available. ,N/A,N/A,N/A,N/A,N/A
TrSoft-Inc,https://github.com/TrSoft-Inc,N/A,Other,Seems to be some of the code for an NFT website/exchange,Product/service sales income,,Not centrally organized (just the GitHub and nothing else),,N/A,,N/A,N/a,"Alchemy, FlowBlockchain","Is divided into two softwares. FlowBlockchain is a smart contract for NFT transfer, and Alchemy is the actual NFT platform. However, it is not complete, so there must be other code existing somewhere. There is nothing about control over the project",N/A,N/A,N/A,,
wannaswap,"https://github.com/wannaswap
",N/A,Other,Automatic Money Market,Product/service sales income,,Private company ,,https://coinmarketcap.com/currencies/wannaswap/,,"2,740,000","100,000,000",Aurora,,N/A,N/A,N/A,,
startatlasmeta,https://github.com/staratlasmeta,N/A,Token,,Others,Income is earned as players transfer assets in game. ,"Other (if DAO, specify name in DAO Name column)",,https://coinmarketcap.com/currencies/star-atlas-polis/,,"257,624,349","360,000,000","Phantom, Ledger, Coinbase",A video game that has its own currency for buying in-game assets. ,N/A, Star Atlas DAO,N/A,,
quark-project,https://github.com/quark-project,N/A,Token,,Public token sale,,Private company ,,https://coinmarketcap.com/currencies/quark/,,"290,667,510 QRK","290,667,510 QRK",N/A,,N/A,N/A,N/A,,
KMPARDS,https://github.com/KMPARDS,N/A,Other,"A company that offers many blockchain related services such as an education app, a wallet, and an exchange. ",Product/service sales income,,Private company ,,N/A,N/A,N/A,N/A,N/A,,N/A,N/A,N/A,,
linear-protocol,https://github.com/linear-protocol,N/A,Other,Liquid Staking Protocol,Others,Was not able to find,"Other (if DAO, specify name in DAO Name column)",,https://coinmarketcap.com/currencies/linear-protocol-org/,N/A,"800,000,000","1,000,000,000",N/A,"Offers the ""best way to stake NEAR""",N/A,LiNEAR DAO,N/A,,
MindCoinTeam,https://github.com/MindCoinTeam,N/A,Token,,Public token sale,,Private company ,,N/A,N/A,N/A,N/A,N/A,The website is blocked because my computer detected a virus. There is almost no information availible. ,N/A,N/A,N/A,,
niftyx,https://github.com/niftyx,N/A,DApp,,Product/service sales income,,,N/A,N/A,N/A,"51,386,058","65,557,424",N/A,,N/A,Niftyx DAO,N/A,,
PanIndustrial-Org,https://github.com/PanIndustrial-Org,N/A,Other,I do not know,,,Not centrally organized (just the GitHub and nothing else),N/A,N/A,N/A,N/A,N/A,N/A,No information availible on the web,N/A,N/A,N/A,,
PrimLabs,https://github.com/PrimLabs,N/A,Other,An organization that researches crypto,Others,Do not know,Not centrally organized (just the GitHub and nothing else),,N/A,,,,N/A,,,,,,
RubiconDeFi,https://github.com/RubiconDeFi,N/A,Crypto exchange,,Product/service sales income,,Private company ,,N/A,,,,N/A,,,,,,
Solanascan,https://github.com/Solanascan,N/A,DApp,,Product/service sales income,,,,N/A,,,,N/A,,,,,,
Aptid,https://github.com/aptid,N/A,DApp,,Crowdfunding without token,,Consortium,,N/A,N/A,na,na,unknown,,na,na,na,,
bibox365,https://github.com/bibox365,N/A,Crypto exchange,,Public token sale,,Private company ,,https://coinmarketcap.com/currencies/bibox-token/,N/A,85.43 million ,235.97 million ,unknown,,na,na,na,,
standard-hashrate-group ,https://github.com/Standard-Hashrate-Group,N/A,Token,,Others,,"Other (if DAO, specify name in DAO Name column)",,na,na,na,na,Yes(Defi space) ,,na,Bitcoin Standard Hashrate Token DAO,"December 13, 2020",,
Coinswap-space,https://github.com/CoinSwap-Space,N/A,DApp,,Product/service sales income,liquidity provision and staking rewards,Not centrally organized (just the GitHub and nothing else),,https://coinmarketcap.com/currencies/coinswap-space/,CSS,0.4 M,19.9 M,"LIquidity providers; yield farmers and stakers; auditing partners(Certik); integration partners (Klever Wallet
Crypto Nuts
Dex.guru
Coin Market Cap
Ramp
Comparic
Metatalent
ESE
Certik
APE BOARD
ChartEx
CoinPapprika
CryptoCompare
DappRadar
WordCoinIndex) ",,na,,04/30/2021,,
Digital entertainment asset ,https://github.com/Digita-Entertainment-Asset,N/A,Token,,Product/service sales income,,Private company ,,https://coinmarketcap.com/currencies/deapcoin/,,24.83 B,30 B ,Blockchain Game Alliance; Fintech association ,,less than 4%,,na,,
earthwallet ,https://github.com/earthwallet,N/A,Wallet,,Product/service sales income,,"Other (if DAO, specify name in DAO Name column)",,na,,na,na,Bitcoin and Ethereum,,na,Earth Dao ,na,,
FiiLab,https://github.com/FiiiLab,N/A,Wallet,,Product/service sales income,,Private company ,,na,na,na,na,,"FiiiLab is dedicated to creating innovative blockchain solutions and providing digital asset management tools. The organization is active in the blockchain community, engaging in various projects to advance the use of blockchain technology.",na,,na,,
goldcoin ,https://github.com/goldcoin,N/A,Token,,Product/service sales income,,Private company ,,https://coinmarketcap.com/currencies/goldcoin/,GLC,43.68 M,72.2 M,yes, Goldcoin does not specify a cap on the total number of tokens. It focuses on scalability and on-chain transactions.,na,na,na,,
iden3,https://github.com/iden3,N/A,Other,identity protocol ,Others,grants partnerships/venture capital,Private company ,,na,,na,na,"yes(Polygon Hermez, Dark Forest, Zkopru, and Tornado Cash)",focuses on blockchain-based identity management solutions ((zero-knowledge succinct non-interactive arguments of knowledge),na,na,na,,
kuroshibaONE,https://github.com/KuroShibaONE,N/A,Memecoin,Defi project,Product/service sales income,grants,"Other (if DAO, specify name in DAO Name column)",,na,na,na,na,yes(Harmony blockchain communit; discord; telegram; twitter),Kuro Shiba inspired by the popular internet meme(dogcoin and shiba inu) also defi project ,unknown,Kuro Shiba Dao,na,,
maxixyz,https://github.com/maxixyz,N/A,Other,Defi project,Product/service sales income,,Private company ,,na,na,na,na,yes (broader defi community-Pangolin and Trader Joe),,na,na,na,,
naos-finance ,https://github.com/NAOS-Finance,N/A,Other,defi project,Public token sale,venture capital,"Other (if DAO, specify name in DAO Name column)",,https://coinmarketcap.com/currencies/naos-finance/,NAOS Finance Ecosystem ,84.22 M,500 M,"yes(DefiLlama, other blockchain projects, and other social media platforms)",,20%,NAOS DAO,na,,
okp4,https://github.com/okp4,N/A,L1 protocol,,Donations,grants and partnerships,Private company ,private company transitioning to DAO ,na,na,na,na,Yes(Validators and Developers-cumulo; chainlayer; nodestake; lavender.five nodes; aviaone.etc),rebranded as axone,unknown,Axone Dao ,na,,
pchain-org,https://github.com/pchain-org,N/A,L1 protocol,,Others,venture capital ,Private company ,,https://coinmarketcap.com/currencies/pinetwork/,PItoken , na,100B,yes(web3Foundation; a community of validators),enhance the scalability and interoperability of blockchain networks ,20%,na,na,,
raetoken,https://github.com/raetoken,N/A,DApp,defi project ,Product/service sales income,also venture capital ,Private company ,,na,RAE token,na,na,"Yes(Rokfin, ethereum community, defi developers, content creators)",aligns the interests of content creators and digital platforms ,na,na,na,,
shroom-finance,https://github.com/shroom-finance,N/A,DApp,defi project ,Product/service sales income,community funding as well,"Other (if DAO, specify name in DAO Name column)",,https://coinmarketcap.com/currencies/niftyx-protocol/,SHROOM token ,51.39M,65.56 M,"Yes(ethereum community, gameswap, defi community; IPFS Oxprotocol; opensea compatibility)",,na,Shroom DAO ,na,,
yottachain,https://github.com/yottachain,N/A,L1 protocol,,Others,venture capital,Private company ,,https://coinmarketcap.com/currencies/yottachain/,YottaChain ecosystem​ ,0,4B,Yes(Developers/validators; singapore yottachain foundation) ,secure decentralized storage solution ,20%,na,na,,
tiesnetwork ,https://github.com/TiesNetwork,N/A,DApp,decentralized business platform ,Token sale ,,"Other (if DAO, specify name in DAO Name column)",,https://coinmarketcap.com/currencies/tiesdb/,TIE token,40.8M,59.3 M,yes(ethereum community/decentralized business networks)," facilitate efficient business interactions by providing a secure, decentralized platform for networking and collaboration​",unknown ,Ties DAO,na,,
