ProjectName,GithubLink,WikipediaPageLink,ProjectType,Other_ProjectType,FundingModel,Other_FundingModel,GovernanceMode,Other_GovernanceMode,GovernanceToken_CoinmarketcapLink,Other_HasGovernanceToken,GovernanceTokens_Count,GovernanceTokens_Cap,AssociatedCommunities,FreeComments,% Tokens reserved for developers or team,DAO Name,Date of governance model change,,
Example1,https://github.com/ethereum,,L1 protocol,,Public token sale,,Non-profit foundation,,,"Ethereum improvement protocol is used to vote on changes, https://eips.ethereum.org",,,"ETH Cat Herders, https://www.ethereumcatherders.com
ETH Magicians Forum, https://ethereum-magicians.org",,,,,,
Example2,,,Stablecoin,,Public token sale,,Other,"Controlled by DAO; 
previously associated with Maker Foundation - non-profit",https://coinmarketcap.com/currencies/maker/,,"928,666","1,005,577","Maker DAO forum, https://forum.makerdao.com",,,,,,
Aldrin Exchange,https://github.com/makerdao,https://github.com/aldrin-exchange,Crypto exchange,,Public token sale,,Private company ,,https://coinmarketcap.com/currencies/aldrin/ ,,0,0,No associated communities,No data available for Cap for Governance Tokens,,,,,
AWARE Foundation,https://github.com/AwareFoundation,,Token,,Public token sale,,Non-profit foundation,,No governance token,,N/A,N/A,No associated communities,,,,,,
Blockchain Game Alliance,https://github.com/blockchaingamealliance,,Other,Blockchain Gaming,Product/service sales income,,Consortium,,https://coinmarketcap.com/currencies/blockchain-game-alliance/,,0,0,No associated communities,,,,,,
Chainhub,https://github.com/chainhub,,L1 protocol,,Crowdfunding without token,,Not centrally organized,,No governance token,,N/A,N/A,No associated communities,,,,,,
Anmol Network,https://github.com/anmolnetwork,,L2 network,,Crowdfunding without token,,Private company ,,No governance token,,N/A,N/A,No associated communities,,,,,,
Amara Finance ,https://github.com/AmaraFinance,,DApp,DeFi,Public token sale,,Not centrally organized,, https://coinmarketcap.com/currencies/amara-finance/ ,,"49,200,000","1,500,000,000",No associated communities,,10%,AmaraLend DAO,N/A,,
EOSLaoMao ,https://github.com/EOSLaoMao,,L1 protocol,,Product/service sales income,,Consortium,,No governance token ,,0,0,No associated communities,,N/A,,N/A,,
Airbloc,https://github.com/airbloc,N/A,DApp,,Public token sale,,Private company ,,No governance token ,,,,No associated communities,"ABL is their utility token
Source for finding out that it's a private company
they rely on https://klaytn.foundation/",N/A,,N/A,,
Australis Finance,https://github.com/Australis-Finance,N/A,DApp,,Others,"not explicitly stated, but commission on borrowing",Not centrally organized (just the GitHub and nothing else),,No governance token,,,,No associated communities,"Early Stage Development => Not Much Info
It relies on https://aurora.dev/",N/A,,N/A,,
Blackmoon Financial Group,https://github.com/blackmoonfg,"Founder:
https://en.wikipedia.org/wiki/Ilya_Perekopsky",Other,Marketplace Lending as a Service (MPLaaS),,ICO + raises capital through loans facilitated on its platform,"Other (if DAO, specify name in DAO Name column)","Private Company, operates under Blackmoon Financial Group and 
BreakingFin Management LTD",No governance token,,,,"Blackmoon Financial Group
BreakingFin Management LTD","BMC is their utility token
Seems to be 2 companies:
1. the Marketplace
2. Blockchain IT consultancy",N/A,,N/A,,
BeexOpen,https://github.com/beexopen,,Crypto exchange,,Product/service sales income,,Not centrally organized (just the GitHub and nothing else),,no governance token,,N/A,n/a,No associated communities,"very little information, no website or social medias- oftentimes information is in chinese. Governance/funding is an assumption made via documentation in the code.",,,,,
BankToTheFuture,https://github.com/BankToTheFuture,,Web 2.0 business,,Public token sale,,Not centrally organized,, https://coinmarketcap.com/currencies/bnktothefuture/,,0,"1,000,000,000",No associated communities,"The CMC team has not verified the project's circulating supply. However, according to the project, its self-reported CS is 0.00 BFT with a self-reported market cap of $0.",N/A,,N/A,,
cykura,https://github.com/cykura,,L2 network,,Public token sale,,Not centrally organized,Controlled by Dao , https://coinmarketcap.com/currencies/cyclos/,,"6,180,000","100,000,000",No associated communities,,N/A,Tribeca DAO,,,
Circelpod,https://github.com/Circelpod,,Crypto exchange,,Public token sale,,Not centrally organized,,https://coinmarketcap.com/currencies/circlepod/,,"30,204,079","528,485,903",No associated communities,Was renamed to Circlepod,N/A,,,,
Cryptonex,https://github.com/Cryptonex ,,Crypto exchange,,Product/service sales income,,Private company ,,https://coinmarketcap.com/currencies/cryptonex/,,"105,094,000","210,000,000",No associated communities,https://cryptonex.org/,,,,,
Digipulse IO,https://github.com/digipulseio,,Wallet,,Product/service sales income,,Private company ,,No governance token,,N/A,N/A,No associated communities,rely on https://www.f6s.com/company/digipulse.io#about. Company website was given but directed to a random chrome extension.,,,,,
VaultsProtocol,https://github.com/VaultsProtocol,,Token,,Product/service sales income,,Not centrally organized,,No governance token,,N/A,N/A,No associated communities,No online information other than Github page,,,,,
FuturoCoin,https://github.com/futuro-coin,,Wallet,,Product/service sales income,,Private company ,,https://coinmarketcap.com/currencies/futurocoin/,,0,0,No associated communities,,,,,,
Holgern,https://github.com/holgern,,Other,Programming Files,Others,None,Not centrally organized,,No governance token,,N/A,N/A,No associated communities,No online information other than Github page,,,,,
Joule,https://github.com/JouleTeam,,Wallet,,Donations,,Private company ,,https://coinmarketcap.com/currencies/joule/,,"1,010,499,999",0,No associated communities,People earn Joule tokens based on popularity index.,,,,,
Lonero,https://github.com/Lonero-Team,,Wallet,,Public token sale,,Not centrally organized,,No governance token,,N/A,N/A,No associated communities,No online information other than Github page. Integrating a DAO,,,,,
Modum IO,https://github.com/modum-io,,Other,Blockchain Tech,Product/service sales income,,Private company ,,No governance token,,N/A,N/A,No associated communities,Rely on https://www.startup.ch/modumIO ,,,,,
ChangeNow IO,https://github.com/ChangeNow-io,,Crypto exchange,,Public token sale,,Private company ,,https://coinmarketcap.com/currencies/now-token/,,"84,803,670","200,000,000",r/ChangeNOW_io - reddit,Website: https://changenow.io/?from=usd&to=btc&fiatMode=true,,,,,
Peaq Network,https://github.com/peaqnetwork,,Other,DePIN Builder,Product/service sales income,,Private company ,,https://coinmarketcap.com/currencies/peaq/,,0,"4,200,000,000",No associated communities,https://www.peaq.network/,,,,,
Publica IO,https://github.com/PublicaIO,,Token,,Product/service sales income,,Private company ,,https://coinmarketcap.com/currencies/publica/,,"18,582,933",0,No associated communities,https://publica.com/. No data for max token supply. NFTs for books.,,,,,
Sarcophagus,https://github.com/sarcophagus-org,,Other,Dead Man's Switch,Product/service sales income,,Not centrally organized,,https://coinmarketcap.com/currencies/sarcophagus/,,"39,260,000",0,No associated communities,https://sarcophagus.io/. No data given for max supply.,,,,,
SovranoCoin,https://github.com/SovranoCoin,,Wallet,,Public token sale,,Private company ,,https://coinmarketcap.com/currencies/sovranocoin/,,"1,569,436","6,000,000",No associated communities,Rely on https://coinmarketcap.com/currencies/sovranocoin/,,,,,
Taggr Network,https://github.com/TaggrNetwork,,Web 2.0 business,,Product/service sales income,,Not centrally organized,,No governance token,,N/A,N/A,No associated communities,https://taggr.network,,,,,
Ulord,https://github.com/UlordChain,,Other,Cloud Ecosystem,Product/service sales income,,Private company ,,https://coinmarketcap.com/currencies/ulord/,,"83,637,915","1,000,000,000",No associated communities,http://ulord.one/,,,,,
WePiggy,https://github.com/WePiggy,,Other,Crypto Bank,Product/service sales income,,Not centrally organized,,https://coinmarketcap.com/currencies/wepiggy/,,0,"8,000,000,000",No associated communities,https://wepiggy.com/. Controlled by DAO.,,,,,
aave,https://github.com/aave,,DApp,,Public token sale,,Other,DAO,https://coinmarketcap.com/currencies/aave/,,"16,000,000",--,https://governance.aave.com/ and https://discord.com/invite/aave,Grants DAO,7.06%,"""Aave Grants DAO""",--,,
Arken Lab,https://github.com/arken-lab,,DApp,,Product/service sales income,,Not centrally organized,,https://coinmarketcap.com/currencies/arken/,,"1,000,000,000","10,000,000,000",https://discord.com/invite/GPWDsEAaE7?utm_source=landing&utm_medium=NavBar,Offers many services to traders and is based on a few DeFi breakthroughs listed on their home page,24.10%,--,--,,
eveybcd,https://github.com/eveybcd,,DApp,,Product/service sales income,,Other,Seems decentralized with a core team of developers but not much information is available since there is no existing website,No governance token,,--,--,Associated with bitcoin diamond,Very little information on this project,--,--,--,,
campuscoindev,https://github.com/campuscoindev,,DApp,,Others,community supported mining,Not centrally organized,,No governance token,,--,--,Associated with campus coin ,,--,--,--,,
coordinape,https://github.com/coordinape,,DApp,,Crowdfunding without token,,Not centrally organized,,No governance token,,--,--,Lots of the project is done through discord: https://discord.coordinape.com/,,--,--,--,,
DeFinerOrg,https://github.com/DeFinerOrg,,DApp,,Public token sale,Also offers incentives for investing/participating,Other,DAO,https://coinmarketcap.com/currencies/definer/,,"168,000,000","168,000,000",No associated communities,There is social media prescence but it is limited,5%,DeFiner DAO,--,,
eluv-io,https://github.com/eluv-io,,Other,web 3.0 business,Product/service sales income,,Private company ,,No governance token,,--,--,https://eluv.io/about/partners,Massive presence with over a dozen partners listed on their website,--,--,--,,
flooz-link,https://github.com/flooz-link,,DApp,,Product/service sales income,,"Other (if DAO, specify name in DAO Name column)",Managed by a team of experts,No governance token,,--,--,No associated communities,Website can be found on twitter: https://x.com/flooz_xyz,--,--,--,,
guild-w,https://github.com/guild-w,,DApp,,Crowdfunding without token,,"Other (if DAO, specify name in DAO Name column)",a few blockchain game players and developers and also very community driven,No governance token,,--,--,https://twitter.com/marrowdao,,--,--,--,,
Centric,https://github.com/Centric-Org,N/A,Other,"ecosystem
Centric Cash (CNS) = stablecoin
Centric Rise (CNR) = deflationary token
https://www.centric.com/whitepaper",Product/service sales income,,Non-profit foundation,"Centric Foundation oversees the project and the governance
",No governance token,,,,,"partnership with: https://www.moolahverse.com/?sidebar=true
source: https://changenow.io/blog/cns-overview",N/A,,N/A,,
Cryptex Finance,https://github.com/cryptexfinance,N/A,Other,ecosystem,Others,fees generated through trading activity,"Other (if DAO, specify name in DAO Name column)",,https://coinmarketcap.com/currencies/cryptex-finance/,,"6,578,108","10,000,000",,,N/A,CTX DAO,N/A,,
DFINITY Lab,https://github.com/dfinity-lab,"Founder:
https://www.linkedin.com/in/thedwilliams/",L1 protocol,,Others,"Fundraisers and Private Investments, but no ICO",Non-profit foundation,Dfinity Foundation oversees the project and the governance,https://coinmarketcap.com/currencies/internet-computer/,,"465,573,319","520,197,741",NNS: https://internetcomputer.org/nns,"Despite efforts to decentralize, there are 
criticisms that the Dfinity Foundation holds 
significant control over the project through 
mechanisms like the NNS",N/A,Network Nervous System (NNS),"May 2021, NNS governance system",,
Essentia,https://github.com/essentiaone,N/A,DApp,,Others,"Private Investors, Transaction Fees",Private company ,"Essentia is an independent, community-oriented organization",No governance token,,,,,"EES = utility token
In their whitepaper they state they are a community-oriented org, but there is no voting system implemented, probably this only means that the devs 'listen' to what the community has to say",N/A,,N/A,,
Jackal Labs Inc.,https://github.com/JackalLabs,N/A,DApp,,Public token sale,,"Other (if DAO, specify name in DAO Name column)","the Jackal Labs team runs the Jackal Protocol
JKL (the governance token) grants on-chain governance participation 
within the Jackal Protocol to vote on text, software, spending, 
and other governance proposals",https://coinmarketcap.com/currencies/jackal-protocol/,,"133,259,784","400,000,000",,Jackal Protocol = ecosystem of DApps,N/A,,N/A,,
Litecoin Foundation,https://github.com/litecoin-foundation,https://en.wikipedia.org/wiki/Litecoin,L1 protocol,,Donations,,Non-profit foundation,,No governance token,,,,,"Litecoin = digital currency

Litecoin Foundation, while influential, does not 
have direct control over the blockchain protocol itself 
but supports its development and adoption.","just 150 were held by the founder, but he sold/donated them since it was a conflict of interest",,N/A,,
Mirror World,https://github.com/mirrorworld-universe,"Founder:
https://www.linkedin.com/in/chrizhuu/",DApp,,Product/service sales income,+ Private Investors,Private company ,,No governance token,,,,,"Mirror World = DApp ecosystem (related to NFTs) that facilitates 
the creation and management of DApps through its platform",N/A,,N/A,,
Chainify,https://github.com/chainify,N/A,Other,"web3 incubation center, web3 consultancy for businesses",Product/service sales income,,Private company ,,No governance token,,,,,Website: https://www.chainify.dev/,N/A,,N/A,,
PartySwap,https://github.com/PartySwapDEX,N/A,Crypto exchange,,Product/service sales income,,Private company ,,No governance token,,,,,"PartySwap = decentralized exchange space 
(operational decisions are made by developers 
and possibly influenced by community feedback)

PARTY = utility token

The project seems to have died out: https://partyswap.io/news/our-latest-update-2022/

Their Web App: https://partyswap.io/

they were planning to create a DAO in the future",N/A,,N/A,,
Proof of Humanity,https://github.com/Proof-Of-Humanity,N/A,DApp,,Product/service sales income,+ Donations,"Other (if DAO, specify name in DAO Name column)",,https://coinmarketcap.com/currencies/universal-basic-income/,,"25,025,371","no cap (UBI tokens are 
continuously minted based 
on verified human identities)",,,N/A,PoH DAO,N/A,,
Abjcoin Blockchain,https://github.com/abjcoinblockchain,--,L1 protocol,,Public token sale,,Not centrally organized (just the GitHub and nothing else),,https://coinmarketcap.com/currencies/abjcoin/,,"9,233,130",--,--,AbjcoinCommerce is a decentralized blockchain marketplace made to connect African meerchants with the rest of the world. It uses a Proof of Stake (PoS) protocol to helps nodes come to a consensus to validate dilital ledgers. ,--,--,--,,
Arqma Network,https://github.com/arqma,--,Token,,Public token sale,,Private company ,,https://coinmarketcap.com/currencies/arqma/,,"24,756,550","50,000,000",--,"Arqma is a cryptocurrency sold on nonkyc, TradeOgre, and bisq. It focuses on speed, security, and anononimity. ",--,--,--,,
Bitcoin-PRO,https://github.com/Bitcoin-PRO,--,Token,,Public token sale,,Not centrally organized (just the GitHub and nothing else),,https://coinmarketcap.com/currencies/bitcoin-pro/,,"2,100,000",--,--,"Bitcoin-PRO is a cryptocurrency, identifed on-market by the ticker BTCP. Aside from the GitHub and the ticker, not much other information about the organization was found. ",--,--,--,,
cannation,https://github.com/cannationproject,--,Token,,Public token sale,,Not centrally organized (just the GitHub and nothing else),,https://crypto.com/price/cannation,,"2,480,000",--,--,"Cannation is a cryptocurrency that is identified by the ticker symbol, CNNC. It is based upon a consensus mechanism called Proof of Stake (PoS), which is what Ethereum 2.0 uses",--,--,--,,
Coreum,Coreum,--,L1 protocol,,Public token sale,Gas fees on transactions or founders buying the token and selling at an appreciated price,Private company ,,https://coinmarketcap.com/currencies/coreum/,,545670000,--,--,Coreum is an L1 blockchain that acts as a framework to facilitate the automated and predetermined behaviors of smart tokens. ,--,--,--,,
Crypto-Currency,https://github.com/Crypto-Currency,--,Token,,Public token sale,,Private company ,,https://coinmarketcap.com/currencies/litecoin-plus/,,2752341,4000000,--,SypderByte is a token that uses the Proof of Work consensus mechanism and employs a dynamically controlled structure,--,--,--,,
Flowchain,https://github.com/flowchain,--,L1 protocol,,Public token sale,,Private company ,,https://coinmarketcap.com/currencies/flooring-lab-credit/,,25000000000,25000000000,--,Flowchain is a distributed blockchain ledger meant to tokenize Internet of Things (IoT) devices. ,--,--,--,,
hai-on-op,https://github.com/hai-on-op,--,Stablecoin,,Public token sale,,Private company ,,https://defillama.com/stablecoin/lets-get-hai,,1620000,1590000,--,"In the Let's Get Hai protocol, HAI is a stablecoin that is valued in storage units called vaults, in which users can deposit various types of assets as collatoral. ",--,--,--,,
InsurChain,https://github.com/InsurChain,--,L1 protocol,,Public token sale,,Not centrally organized (just the GitHub and nothing else),,https://coinmarketcap.com/currencies/insurchain/,,20000000000,--,--,"InsurChain caters to be the global provider of blockchain insurance markets, facilitated by the InsurChainCoin (INSUR) token. ",--,--,--,,
LESS.xyz,https://github.com/LESS-xyz,--,,,,,,,,,--,--,--,NO INFO FOUND,--,--,--,,
Metalde,https://github.com/Metalde,--,Token,,Public token sale,,Not centrally organized (just the GitHub and nothing else),,https://coinmarketcap.com/currencies/metal-blockchain/,,333330000,--,--,Metal Blockchain (METAL) boasts a near-instant transaction finality and is meant to high-performance financial use-cases. ,--,--,--,,
bitshares-cnvote,https://github.com/bitshares-cnvote,--,L1 protocol,,Public token sale,,Private company ,,https://coinmarketcap.com/currencies/bitshares/,,2995318400,3600570502,--,BitShares Blockchain is a decentralized open-source platform that is meant to run financial operations.  ,--,--,--,,
2ⁿᵈ Layer,https://github.com/2nd-Layer,--,,,,,,,--,,--,--,--,NO INFO FOUND,--,--,--,,
0xOlias,https://github.com/0xOlias,--,Other,Backend framework for crypto apps,Product/service sales income,,Private company ,,--,,--,--,--,"Ponder, built by 0xOlias, is a backend framework for crypto apps. ",--,--,--,,
RiseVision,https://github.com/RiseVision,--,L1 protocol,,Public token sale,,Private company ,,--,,--,--,--,"RISE is a Delegated Proof of Stake (DPoS) blockchain that uses the unique DPoS consensus mechanism to validate ledgers and transactions. The DPoS takes a more democratic approach than the conventional Proof of Stake (PoS) mechanism by having users of the blockchain delegate other users to validate the next block of transactions. This puts the responsibility of authenticating user transactions within the hands of the users themselves, thereby stimulating a more involved and hands-on approach to user interactivity with the blockchain. ",--,--,--,,
Agusx1211,https://github.com/Agusx1211,--,L1 protocol,,Product/service sales income,,Private company ,,--,,--,--,--,"Sequence is a blockchain infrastructure platform designed to help developers easily build and deploy decentralized applications (dApps). It offers tools for creating user-friendly crypto wallets, managing digital assets, and integrating blockchain functionalities into various applications. Sequence focuses on providing scalable and secure solutions to facilitate the adoption and development of blockchain technology.",--,--,--,,
Summit DeFi,https://github.com/summit-defi,--,Crypto exchange,,Product/service sales income,i.e. transaction fees for exchanging currencies,Private company ,,--,,--,--,--,"Summit Swap is a decentralized exchange (DEX) platform under the Summit DeFi ecosystem. It enables users to swap various cryptocurrencies in a decentralized manner, providing features such as liquidity pools and staking opportunities for earning rewards.",--,--,--,,
TMC-Official,https://github.com/TMC-Official,--,,,,,,,--,,--,--,--,NO INFO FOUND,--,--,--,,
vivocoin,https://github.com/vivocoin,--,Token,,Public token sale,,Private company ,,https://coinmarketcap.com/currencies/vivo/,,6211794,27200000,--,"The Vivo Project is a cryptocurrency focused on rarity and reliability, established in 2017. It is supported by proof-of-work (PoW) miners and masternodes, offering features like instant and private transactions. The community drives its development decisions.",--,--,--,,
InoCoin,https://github.com/InoCoin,,DApp,,Public token sale,,Private company ,,Ino Coin,,"1,000,000,000",--,No associated communities,Most information is found on the github as opposed to their website (which is very unclear and does not seem to relate to their coin),82.00%,Ino Coin,--,,
lendhub,https://github.com/lendhub,,DApp,,Product/service sales income,,Private company ,,Lendhub,,0.0 (as listed on coinmarketcap),--,No associated communities,,--,--,--,,
METADIUM,https://github.com/METADIUM,,DApp,,Public token sale,,Private company ,,https://coinmarketcap.com/currencies/metadium/,,"2,000,000,000",--,No associated communities,,14.80%,--,--,,
neutral-protocol,https://github.com/neutral-protocol,,Crypto exchange,,Others,Has recieved private funding but also gets commission because of its platform to trade,Private company ,,Has two markest: CHAR and JLT-B23 which represent environmental assets,,--,--,No associated communities,,--,--,--,,
ORSGroup,https://github.com/ORSGroup,,Web 2.0 business,,Product/service sales income,,Private company ,,--,,--,--,No associated communities,,--,--,--,,
Polymesh Association,https://github.com/PolymeshAssociation,,L1 protocol,,Public token sale,,"Other (if DAO, specify name in DAO Name column)",Stakeholders vote for decisions,https://coinmarketcap.com/currencies/polymesh/,,"1,064,897,528",--,No associated communities,,19.50%,--,--,,
Rigel protocol,https://github.com/rigelprotocol,,DApp,,Public token sale,,"Other (if DAO, specify name in DAO Name column)",Community driven decisions,https://coinmarketcap.com/currencies/rigel-protocol/,,"17,494,012",--,No associated communities,,85.70%,--,--,,
Smartlinkhub,https://github.com/Smartlinkhub,,DApp,,Public token sale,,Private company ,,https://coinmarketcap.com/currencies/smartlink/,,"305,492,627",--,No associated communities,,--,--,--,,
sudo graph,https://github.com/sudograph,,DApp,,Donations,,Not centrally organized (just the GitHub and nothing else),,--,,--,--,No associated communities,,--,--,--,,
Dolomite Exchange,https://github.com/dolomite-exchange,,Crypto exchange,,Others,venture capital investments,Private company ,,https://app.dolomite.io/trade/ETH/USDC.e,,"3,200,000,000","10,000,000,000",,"built on the Ethereum blockchain. Dolomite charges fees for transactions on their decentralized exchange (DEX). By facilitating margin trading and liquidity provision, they collect a portion of the fees generated from these activities.",N/A,,,,
Toucan Protocol,https://github.com/ToucanProtocol,,DApp,,Public token sale,,Private company ,,https://coinmarketcap.com/currencies/toucan-protocol-base-carbon-tonne/,,"17,744,545",--,No associated communities,,--,--,--,,
VisionX Team,https://github.com/VisionX-Team,,DApp,,Donations,,Not centrally organized (just the GitHub and nothing else),,--,,--,--,No associated communities,,--,--,--,,
BoringDAO,https://github.com/BoringDAO,,Token,,Public token sale,,Consortium,,https://coinmarketcap.com/currencies/boringdao/,,143642,"200,000",No associated communities,,20%,,,,
Cobinhood,Cobinhood,,Crypto exchange,,Product/service sales income,,Private company ,,--,,--,--,,,,,,,
DAPScoin,https://github.com/DAPScoin,,Token,,Public token sale,,Non-profit foundation,,https://coinmarketcap.com/currencies/daps-coin/,,"57,977,796,500","70,000,000,000",,,10%,,,,
ICPSquad,https://github.com/ICPSquad,--,L1 Protocol,--,Crowdfunding without token,--,Non-Profit Foundation,--,--,--,--,--,--,--,--,--,--,,
Fanaticoscriptos Oficial,https://github.com/fanaticoscriptosoficial,--,DApp,--,Crowdfunding without token,--,Not centrally organized (just the GitHub and nothing else),--,--,--,--,--,--,--,--,--,--,,
GHT-DTS Group,https://github.com/ght-dtsgroup,--,Web 2.0 Business,--,Product/Service Sales Income,--,Private company ,--,--,--,--,--,--,--,--,--,--,,
Crypto-city,https://github.com/Crypto-city,--,Web 2.0 Business,--,Product/Service Sales Income,--,Private company ,--,--,--,--,--,--,--,--,--,--,,
Andoromeda-Foundation,https://github.com/Andoromeda-Foundation,https://wiki.f5nodes.com/andromeda/,L1 protocol,,Public token sale,,Private company ,,--,,--,--,Cosmos Ecosystem,Amdromeda provides AndromedaOS which is a distributed blockchain OS based on the Cosmos Ecosystem. It also supports staking.,14%,Cosmos,--,,
deep0072,https://github.com/deep0072,,DApp,,Donations,,Not centrally organized (just the GitHub and nothing else),,No governance token,,N/A,N/A,N/A,,N/A,,,,
ApolloDAO,https://github.com/apollodao,--,DApp,,Public token sale,,"Other (if DAO, specify name in DAO Name column)",DAO,https://coinmarketcap.com/currencies/apollo-dao/,--,"5,000,000","100,000,000",--,Apollo DAO is a decentralized organization that governs a War Chest for meta-governance and capital investments in decentralized ecosystems.,--,ApolloDAO,--,,
